{
  "$schema": "https://json-schema.org/draft/2020-12/schema",
  "$id": "https://specs.getwololo.dev/eval-result/leaderboard-entry.schema.json",
  "schemaVersion": 1,
  "title": "leaderboard-entry",
  "description": "One (model, harness, skill) ranking row (04-wololo-evals SPEC Sections 3.2 and 5.4). composite_score is identical to the referenced run's frozen runs.composite_score; the leaderboard is a rebuildable read-model over runs, never a second source of truth. Rankings only compare rows sharing one rubric_version.",
  "type": "object",
  "properties": {
    "schemaVersion": { "const": 1 },
    "tenant_id": { "type": "string", "minLength": 1 },
    "model": { "type": "string", "minLength": 1 },
    "harness": { "type": "string", "minLength": 1 },
    "skill_ref": { "type": "string", "minLength": 1 },
    "composite_score": { "type": "number" },
    "suite_version": { "type": "string", "pattern": "^[0-9a-f]{64}$" },
    "rubric_version": { "type": "string", "pattern": "^[0-9a-f]{64}$" },
    "run_id": { "type": "string", "minLength": 1 },
    "n_trials": { "type": "integer", "minimum": 1 },
    "score_stddev": { "type": "number", "minimum": 0 },
    "ci_low": { "type": "number" },
    "ci_high": { "type": "number" },
    "computed_at": {
      "type": "string",
      "pattern": "^\\d{4}-\\d{2}-\\d{2}T\\d{2}:\\d{2}:\\d{2}(\\.\\d+)?(Z|[+-]\\d{2}:\\d{2})$",
      "format": "date-time"
    }
  },
  "required": [
    "schemaVersion",
    "tenant_id",
    "model",
    "harness",
    "skill_ref",
    "composite_score",
    "suite_version",
    "rubric_version",
    "run_id",
    "n_trials"
  ],
  "additionalProperties": false
}
